{
  "$schema": "../schemas/settings_readback_deviation_overlay.schema.json",
  "base_campaign_record": {
    "admission_merge": "3d5e35a8635cb8864a816cf0e589a5831dc2c706",
    "path": "deviations/GCL-GHOS-SETTINGS-READBACK-001.json",
    "repository": "grandchallenge/gcl-standards"
  },
  "campaign_id": "GCL-GHOS-SETTINGS-READBACK-001",
  "claim_boundaries": {
    "certification_claim_authorized": false,
    "commercial_claim_authorized": false,
    "deployment_claim_authorized": false,
    "mathematical_claim_authorized": false,
    "novelty_claim_authorized": false,
    "organization_wide_conformance": false
  },
  "closed_rows": [
    {
      "closure_condition": "Close issue after this overlay is protected and post-merge state is verified.",
      "disposition": "closed_evidence_admitted",
      "id": "ORG-READBACK-BLOCKED-001",
      "priority": "P1",
      "remediation_issue": "https://github.com/grandchallenge/.github/issues/38",
      "resolution": "Complete organization-owner export admitted at grandchallenge/.github merge 45792900aa0198ea30ff2315a897d3c71f119f9a.",
      "scope": "grandchallenge"
    }
  ],
  "effective_condition": "protected_merge_of_this_exact_record",
  "next_gate": "Complete MODULUS and QUANTUM-TECHNOLOGIES protected remediations, then admit a fresh post-repair reread.",
  "open_priority_counts": {
    "P0": 0,
    "P1": 2,
    "P2": 2,
    "P3": 0
  },
  "open_rows": [
    {
      "closure_condition": "Protected remediation plus exact post-repair settings, ruleset, security, and surface reread.",
      "disposition": "repair_required",
      "finding": "Missing governed profile/surfaces; vulnerability alerts and automated security fixes are disabled; CodeQL default setup is not configured; required GCL policy/security checks are absent.",
      "id": "MODULUS-P1-001",
      "priority": "P1",
      "remediation_issue": "https://github.com/grandchallenge/MODULUS/issues/6",
      "scope": "grandchallenge/MODULUS"
    },
    {
      "closure_condition": "Align settings and rulesets or admit a bounded unexpired exception, then reread.",
      "disposition": "repair_required",
      "finding": "Auto-merge is disabled, rebase merging is enabled, merged branches are not deleted, the main ruleset allows rebase, and no immutable release-tag ruleset is present.",
      "id": "MODULUS-P2-001",
      "priority": "P2",
      "remediation_issue": "https://github.com/grandchallenge/MODULUS/issues/6",
      "scope": "grandchallenge/MODULUS"
    },
    {
      "closure_condition": "Protected remediation plus exact post-repair settings, ruleset, security, and surface reread.",
      "disposition": "repair_required",
      "finding": "Missing governed profile/surfaces; automated security fixes are disabled; CodeQL default setup is not configured; stale-review dismissal and strict required checks are disabled; required GCL security check is absent.",
      "id": "QUANTUM-P1-001",
      "priority": "P1",
      "remediation_issue": "https://github.com/grandchallenge/QUANTUM-TECHNOLOGIES/issues/14",
      "scope": "grandchallenge/QUANTUM-TECHNOLOGIES"
    },
    {
      "closure_condition": "Align settings and rulesets or admit a bounded unexpired exception, then reread.",
      "disposition": "repair_required",
      "finding": "Auto-merge is disabled, rebase merging is enabled, merged branches are not deleted, the main ruleset allows rebase, and no immutable release-tag ruleset is present.",
      "id": "QUANTUM-P2-001",
      "priority": "P2",
      "remediation_issue": "https://github.com/grandchallenge/QUANTUM-TECHNOLOGIES/issues/14",
      "scope": "grandchallenge/QUANTUM-TECHNOLOGIES"
    }
  ],
  "operation_id": "GCL-GHOS-SETTINGS-READBACK-OWNER-OVERLAY-001",
  "organization_wide_conformance": false,
  "replacement_evidence": "evidence/settings-readback/GCL-GHOS-OWNER-EXPORT-001.reference.json",
  "status": "open"
}
